category,title
Sport,Kevin Durant Leads Brooklyn Nets to Victory Over Los Angeles Clippers
Health,The Power of Positive Affirmations for Mental Well-being
Business,Netflix Reports Surge in Subscriptions Amidst Pandemic
Sport,Golf Legend Tiger Woods Returns to Competitive Play
Health,The Importance of Vitamin C for Immune System Support
Business,Microsoft Announces Strategic Partnership with SpaceX
Sport,Simone Biles Shatters Gymnastics World Record
Health,Tips for Creating a Relaxing Bedtime Routine
Business,Amazon Expands Cloud Computing Services in Europe
Sport,Soccer Star Lionel Messi Signs Historic Contract with Paris Saint-Germain
Health,The Benefits of Herbal Tea for Digestive Health
Business,Google Launches Sustainability Initiative for Renewable Energy
Sport,Serena Williams Makes Comeback in Grand Slam Tournament
Health,Understanding the Connection Between Gut Health and Mental Health
Business,Apple Unveils Plans for Augmented Reality Glasses
Sport,LeBron James Breaks NBA All-Time Scoring Record
Health,The Importance of Setting Boundaries for Mental Health
Business,Tesla Announces Opening of New Gigafactory in China
Sport,Tom Brady Leads Tampa Bay Buccaneers to NFC Championship Victory
Health,The Role of Omega-3 Fatty Acids in Brain Health
Business,Amazon Faces Criticism Over Working Conditions in Warehouses
Sport,Novak Djokovic Wins Record-Breaking Wimbledon Title
Health,Tips for Practicing Mindful Eating for Weight Management
Business,Facebook Introduces New Privacy Features for Messenger
Sport,Gymnast Simone Biles Wins Gold Medal in Tokyo Olympics
Health,The Impact of Social Media on Mental Health
Business,Microsoft Acquires Gaming Company Bethesda for $7.5 Billion
Sport,Swimmer Michael Phelps Returns to Competition
Health,The Benefits of Outdoor Exercise for Mental Well-being
Business,Google Launches Pixel 6 with Enhanced Camera Features
Sport,Tennis Star Rafael Nadal Clinches US Open Title
Health,The Importance of Deep Breathing Exercises for Stress Relief
Business,Apple Releases MacBook Air with M2 Chip
Sport,Usain Bolt Launches Sports Foundation for Youth Development
Health,The Role of Probiotics in Gut Health
Business,Amazon Web Services Experiences Major Outage
Sport,Golfer Rory McIlroy Wins Masters Tournament
Health,The Benefits of Laughter for Overall Health
Business,Microsoft Partners with Starbucks for Sustainable Packaging
Sport,Boxer Canelo Alvarez Defends World Title in Rematch
Health,The Impact of Screen Time on Sleep Quality
Business,Facebook Faces Legal Challenges Over Data Privacy
Sport,NBA Rookie LaMelo Ball Makes Impressive Debut
Health,The Importance of Establishing a Regular Sleep Schedule
Business,Google Launches Quantum AI Campus in Santa Barbara
Sport,Sprinter Allyson Felix Breaks Olympic Record
Health,The Benefits of Journaling for Mental Clarity
Business,Amazon Expands Delivery Drone Program
Sport,Skateboarder Nyjah Huston Wins X Games Gold
Health,The Importance of Self-Care for Mental Health
Business,Apple Unveils Plans for Self-Driving Car
Sport,Surfer Kelly Slater Wins Pipeline Masters Competition
Health,The Benefits of Spending Time in Nature for Well-being
Business,Tesla Announces Plans for Electric Airplane
Sport,Gymnast Laurie Hernandez Returns to Competitive Gymnastics
Health,The Role of Mindfulness in Pain Management
Business,Google Launches Privacy Sandbox Initiative
Sport,NFL Quarterback Patrick Mahomes Signs Lucrative Contract Extension
Health,The Benefits of Tai Chi for Balance and Mobility
Business,Amazon Launches Fashion Subscription Service
Sport,Boxer Floyd Mayweather Jr. Returns to the Ring
Health,The Importance of Regular Physical Activity for Children
Business,Apple Introduces New AirPods with Noise-Canceling Technology
Sport,Golfer Phil Mickelson Wins PGA Championship
Health,The Benefits of Aromatherapy for Stress Relief
Business,Microsoft Invests in Clean Energy Projects
Sport,NBA Star Giannis Antetokounmpo Wins MVP Award
Health,The Impact of Social Support on Mental Health
Business,Google Acquires Health Tracking Company Fitbit
Sport,Tennis Pro Bianca Andreescu Wins Grand Slam Title
Health,The Benefits of Outdoor Activities for Physical Health
Business,Amazon Faces Antitrust Investigation Over Marketplace Practices
Sport,Soccer Phenom Kylian Mbappé Signs Record Contract Extension
Health,The Role of Nutrition in Skin Health
Business,Apple Launches App Store Small Business Program
Sport,Olympic Swimmer Katie Ledecky Sets New World Record
Health,The Importance of Establishing Healthy Sleep Habits
Business,Tesla Announces Plans for Sustainable Battery Recycling
Sport,Skier Mikaela Shiffrin Wins World Cup Title
Health,The Benefits of Expressive Writing for Emotional Well-being
Business,Microsoft Teams Surpasses 250 Million Active Users
Sport,BMX Rider Hannah Roberts Wins X Games Gold
Health,The Importance of Social Connections for Mental Health
Business,Google Launches Virtual Reality Training Program
Sport,NHL Star Connor McDavid Wins Hart Trophy
Health,The Benefits of Gratitude Practice for Mental Wellness
Business,Amazon Launches Pharmacy Delivery Service
Sport,Gymnast Sunisa Lee Wins All-Around Gold at Olympics
Health,The Role of Meditation in Managing Chronic Pain
Business,Apple Announces Plans for Carbon-Neutral Supply Chain
Sport,NBA All-Star Luka Don?i? Signs Shoe Deal
Health,The Benefits of Herbal Remedies for Stress Management
Business,Microsoft Partners with NASA for Space Exploration
Sport,Surfer Carissa Moore Wins World Title
Health,The Importance of Healthy Eating During Pregnancy
Business,Tesla Announces Plans for Solar-Powered Charging Stations
Sport,MMA Fighter Amanda Nunes Defends Title
Health,The Role of Music Therapy in Mental Health Treatment
Business,Google Launches AI Research Lab in Switzerland
Sport,Tennis Champion Naomi Osaka Wins Olympic Gold
Health,The Benefits of Mindful Walking for Stress Reduction
Business,Amazon Opens Cashierless Grocery Store in New York
Sport,Skateboarder Tony Hawk Lands Historic Trick
Health,The Importance of Setting Realistic Goals for Mental Health
Business,Apple Launches Sustainability Program for Suppliers
Sport,Golfer Bryson DeChambeau Wins U.S. Open
Health,The Benefits of Pets for Emotional Support
Business,Microsoft Teams Introduces End-to-End Encryption
Sport,NFL Quarterback Russell Wilson Leads Seahawks to Playoffs
Health,The Importance of Vitamin D for Bone Health
Business,Google Launches AI Ethics Council
Sport,Olympic Sprinter Allyson Felix Wins Gold Medal
Health,The Role of Mindfulness in Managing Chronic Illness
Business,Amazon Expands Grocery Delivery Service
Sport,Basketball Star Damian Lillard Wins Scoring Title
Health,The Benefits of Progressive Muscle Relaxation for Stress Relief
Business,Apple Announces Plans for Zero-Waste Packaging
Sport,Surfer John John Florence Wins Pipe Masters Competition
Health,The Importance of Gratitude Practice for Mental Health
Business,Microsoft Acquires Gaming Company ZeniMax Media
Sport,NBA Star Kawhi Leonard Signs Sneaker Deal
Health,The Benefits of Nature Walks for Mental Well-being
